Title,Use Cases,Description,Website,Logo,Author,Average Rating,Rating Count,Primary Task,Tags,Price
Paraphrasing Tool by Leap,Rephrase any text in seconds with this free AI paraphrasing tool.,"The Leap AI Paraphrasing Tool is an advanced AI-powered application designed to rephrase text with precision, speed, and versatility. It allows users to rewrite, edit, and alter the tone of sentences effectively, preserving the original meaning while delivering a different expression. This tool is beneficial for a myriad of user profiles such as content creators, students, and professionals who need regular and reliable text rephrasing. The Leap AI Paraphrasing Tool also serves as an invaluable asset in avoiding plagiarism and enhancing the quality and uniqueness of the written content. It simplifies the time-consuming and often complex process of manual text paraphrasing, making the task easier and more efficient. This tool can change the language style based on user requirements to provide a more creative rewrite, formal tone, concise summary, or standard paraphrase. Another standout feature is its ability to contribute towards SEO-optimized text, resulting in enhanced visibility on search engines which is particularly useful for sales and marketing teams, business professionals, and writers. The tool is free and accessible to all users, demonstrating a commitment to wide-reaching accessibility and application. The Leap AI Paraphrasing Tool is sure to provide an invaluable aid to users across a broad range of industries by enhancing their text and saving them valuable time. Help other people by letting them know if this AI was useful.",https://www.tryleap.ai/tools/paraphrasing-tool?ref=taaft&utm_source=taaft&utm_medium=referral,https://media.theresanaiforthat.com/assets/favicon-large.png,Lewis Carhart,3.0,2,Paraphrasing,"text rephrasing, content creation, academic assistance, professional writing, plagiarism avoidance, seo optimization",Free
COACH,AI-powered career development platform built by career experts.,"COACH, developed by CareerVillage, is an AI-enabled career coaching tool aimed to facilitate career readiness for a wide user base, ranging from students to job-seekers. The tool's purpose is to assist users in various aspects of the career exploration and planning process. This includes guidance on identifying career paths, understanding the skills required for these careers and insights on how AI factor into these careers.COACH provides high-quality resources to help individuals develop needed technical and soft skills. It can guide users towards college or alternative education options that align with their career goals and personal preferences. Further, it helps users relate their school subjects to different careers, answering potential questions about the relevance of their academic studies to future career paths. With a focus on job preparation, COACH provides resources to help users craft cover letters and resumes, map their networks of support, and prepare for job interviews. COACH is also presented as a career development platform for students, job seekers, and career shifters, offering actionable guidance for every career stage and effective career readiness measures for those in the education sector. The tool's data-driven approach allows it to provide personalized, adaptive career readiness support, thereby facilitating improved decision-making for learners. Beyond career exploration and readiness, COACH also serves as a resource for educators and career counselors, enabling them to gain insights about learners' career readiness and extend their guidance to reach more learners. Help other people by letting them know if this AI was useful.",https://www.aicareercoach.org/?ref=taaft&utm_source=taaft&utm_medium=referral,https://media.theresanaiforthat.com/assets/favicon-large.png,CareerVillage,5.0,2,Career development,"career development, career advice, career mentoring, career counseling, career matchmaking, career forecasting",No price available
Swift AI Writer,Effortlessly craft and bring ideas to life with AI.,"Create Ebook in Seconds is an AI-driven tool designed to assist with the crafting of various types of publications, including fiction, non-fiction, storybooks, and compilations of quotes. The key capability of this application is to enhance creativity and streamline the ebook creation process. Leveraging AI technology, it aims to ensure ideas are brought to life in an effective and engaging manner. It operates by removing obstacles often faced in traditional ebook development such as complex formatting and design processes. While the specific operation of the AI technology isn't detailed in the description, it hints at providing an intuitive and easy-to-use interface, potentially with built-in templates or guides. This could prove especially useful for novice writers or individuals looking to create professional-looking ebooks in a shorter time span. It should be highlighted that this tool requires JavaScript to operate, indicating its web-based nature. Overall, 'Create Ebook in Seconds' offers a promising solution for aspiring writers and publishers by automating some aspects of the ebook creation process through AI. Help other people by letting them know if this AI was useful.",https://swiftaiwriter.com/home?ref=taaft&utm_source=taaft&utm_medium=referral,https://media.theresanaiforthat.com/assets/favicon-large.png,Unknown Author,0.0,0,eBooks,"ebook creation, ai-assistant, writing automation, creativity enhancement, writing tool, publishing",Free + from $2.99
Dream Machine AI,Transform text and images into high-quality videos instantly with Dream Machine AI.,"Dream Machine AI is an instant-access video generation model that turns text and images into high-quality videos. Functioning based on the Luma AI platform, which leverages advanced transformer models, this tool can swiftly produce physically accurate and consistent video content. Moreover, the tool successfully reproduces complex spatiotemporal motions, proving its capacity for intricate video content generation. Particular emphasis is placed on maintaining character consistency within the animated content, as well as simulating real-world physical characteristics. In addition to this, the tool implements smooth and natural camera movements, contributing to a more authentic emotional tone in each scene. Users can operate Dream Machine AI by inputting their desired text or image prompts, after which the AI commences its rapid video generation process. Although it is subject to a few limitations such as issues with text integration and movement morphing, it is continually being enhanced for improved user experience. The tool's applications are not restricted to any specific type of video and can be beneficial in producing a wide range of video content with realistic and emotionally resonant characteristics. Dream Machine AI is currently free to use and does not involve any charges for its services. Help other people by letting them know if this AI was useful.",https://dream-machine-ai.com/?ref=taaft&utm_source=taaft&utm_medium=referral,https://media.theresanaiforthat.com/assets/favicon-large.png,Adriaan Duncan,3.6,5,Videos,"video generation, ai powered video creation, image to video, text to video, luma ai platform, transformer models",from $6.99
AI Content Detector by Leap,Use our free AI detector to analyze and score text.,"AI Content Detector is a tool designed to analyze text and determine whether it is likely to have been generated by an AI. It is a convenient, easy-to-use solution for users who want to discern whether a piece of content has been created by a machine. The user can paste any piece of text into the tool and it will return a score indicating its likelihood of being AI-generated. The AI Content Detector features a responsive and user-friendly interface, making it efficient for individuals and businesses. Besides its main AI detection function, the tool also offers an array of other applications, including Lead Research, AI SEO Topic Cluster Generator, AI Meta Description Generator, AI Paragraph Generator, and AI Paragraph Rewriter, although these are separate functions and not directly related to the AI detection aspect of the tool. It's important to note that the accuracy of AI Content Detectors may vary and improvement over time can be expected as AI technology evolves. While identifying AI-generated content can be valuable in various spheres, the relevance and necessity of such a tool will depend on the individual user's needs and purposes. Help other people by letting them know if this AI was useful.",https://www.tryleap.ai/tools/ai-content-detector?ref=taaft&utm_source=taaft&utm_medium=referral,https://media.theresanaiforthat.com/assets/favicon-large.png,Lewis Carhart,4.3,6,AI content detection,"ai detection, text analysis, natural language processing, data analysis, ai content validation, lead research tool",Free
Owl AI - Logo generator,Generate a logo for your idea,"Owl AI is an Artificial Intelligence-powered tool designed specifically for generating logos, streamlining the process of establishing branding for individuals, businesses, or other organizations. By leveraging sophisticated AI technology, the generator allows users to directly and efficiently create a variety of logos without the need for professional design experience or knowledge. The tool is flexible enough to generate multiple types of logos, from simple and minimalist to lettermark designs. The logos are produced in a vector format, ensuring clear and sharp output no matter the size of the application. Available features include saving favorite logos for later review, exploring the collective pool of logos generated by the community, and personalizing logos according to user specifications. The tool is designed to save users significant amounts of time and money usually spent on traditional logo design processes. Owl AI - Logo Generator aims to make logo generation accessible, efficient, and user-friendly, tapping the power of AI to meet diverse branding needs. Help other people by letting them know if this AI was useful.",https://app.owlai.art/?ref=taaft&utm_source=taaft&utm_medium=referral,https://media.theresanaiforthat.com/assets/favicon-large.png,Code ninja,2.5,6,Logo design,"logo generation, brand development, design automation, graphic design, vector format, user-friendly",Free + from $19/mo
Amnesia,"Choose, learn, and adventure with Amnesia.","Amnesia: Educational Text-Based Game is an interactive educational tool that utilizes the choose-your-own-adventure narrative style. Simulating an immersive text-based adventure, it allows users to engage with the story's progression through decision-making, promoting active learning and comprehension in a unique and enjoyable format. The educational content embedded within the game can be customized to suit various subject matters, making it adaptable for different learning scenarios. This innovative tool promotes interactive learning through storytelling, encouraging players to make choices that influence the game's narrative. The game's design offers a combination of educational and recreational values, making the learning process more engaging and effective for users. It also enables educators to present complex information in an accessible and engaging way, thereby fostering better understanding and recall. The game has a user-friendly interface and the text-based narrative makes it universally accessible, requiring no graphics or specific hardware capabilities. While precise details may vary over time, the essential function of Amnesia: Educational Text-Based Game as an interactive and adaptable educational tool remains consistent. Help other people by letting them know if this AI was useful.",https://www.playamnesia.com/?ref=taaft&utm_source=taaft&utm_medium=referral,https://media.theresanaiforthat.com/assets/favicon-large.png,Unknown Author,5.0,3,Interactive learning games,"educational tool, interactive learning, choose-your-own-adventure, text-based game, storytelling, active learning",Free
Homie,"Ship code faster with automations, code help, notifications, and reminders.",Help other people by letting them know if this AI was useful.,https://homie.gg/?ref=taaft&utm_source=taaft&utm_medium=referral,https://media.theresanaiforthat.com/assets/favicon-large.png,Mike Wu,0.0,0,Dev team assistance,"project management ai, development team support, software development, task automation, query assistance, github integration",Free + from $15
Kerlig™,Contextual AI Writing Assistant & Chat for macOS,Help other people by letting them know if this AI was useful.,https://www.kerlig.com/?ref=taaft&utm_source=taaft&utm_medium=referral,https://media.theresanaiforthat.com/assets/favicon-large.png,Jarek Ceborski,0.0,0,Productivity,"macos, ai writing assistant, in-context, auto-correction, grammar helper, typo prevention",from $37
BeamAI,Autonomous AI Agents to automate processes.,"The Beam AI platform is a leading solution in the realm of Agentic Automation. The platform specializes in the creation, deployment, and management of Autonomous AI Agents designed to automate various types of tasks and processes. Beam AI agents are general-purpose problem solvers equipped with a human-like understanding to plan and execute diverse workflows swiftly. The platform is widely used by different types of organizations, including Fortune 500 companies and startups, to boost productivity by automating manual workflows. These agents can integrate with a broad and continually expanding selection of third-party tools, working in a very similar way a human would. Beam users can explore a range of pre-existing AI tools, create their own to fit specific needs, or utilise pre-trained agents with domain-specific expertise for immediate deployment. Additionally, the platform offers AI-native support and industry-specific solutions. Its user interface allows for seamless task completion, making it an effective tool for businesses aiming to scale and improve their operational efficiency. Help other people by letting them know if this AI was useful.",https://beam.ai/?ref=taaft&utm_source=taaft&utm_medium=referral,https://media.theresanaiforthat.com/assets/favicon-large.png,Harris Qasim,5.0,1,Workflow automation,"agentic automation, autonomous ai agents, task automation, workflow automation, productivity boosting, general-purpose problem solving",No price available
Flowtrail AI,"Conversational AI Data Analyst: Simplifying Reporting, Amplifying Insights","Flowtrail AI is a sophisticated data analytics tool designed to simplify the process of translating complex data queries into actionable insights. The tool's core functionality revolves around helping users create insightful reports and dashboards from multiple databases, without requiring any specific SQL expertise. This feature makes the journey of data analysis considerably streamlined and enables uncovering valuable insights to make data-driven business decisions. Flowtrail AI serves as an all-in-one data hub, where users can create, analyze, and scale their reports and graphs seamlessly. Creating an account on Flowtrail AI is straightforward, requiring no credit card information. Users can easily connect to their databases, craft and customize complex queries using templates or AI-driven SQL, and cache datasets for faster access. The tool supports multi-database connectivity allowing diverse data sources to be analyzed effortlessly. Furthermore, Flowtrail AI comes with AI-driven query building capability, which simplifies the process of crafting complex queries. The tool also features a Text-to-SQL function that converts plain language into powerful SQL queries. The analytical results can be visualized using a wide library of charts and dashboards provided by Flowtrail AI. The platform also supports the creation of customizable dashboards and allows users to save and share their reports. Help other people by letting them know if this AI was useful.",https://flowtrail.ai/?ref=taaft&utm_source=taaft&utm_medium=referral,https://media.theresanaiforthat.com/assets/favicon-large.png,Flowtrail AI,4.6,8,Data analysis,"data analytics, ai data analytics, complex queries, actionable insights, report creation, dashboard creation",Free + from $8/mo
Automateed,"Create eBooks effortlessly with Automateed, the AI-powered writing tool.","Automateed is an AI-powered ebook creation tool designed to expedite and simplify the book writing and design processes. This all-in-one platform accommodates both novice and veteran authors, using AI to create unique and finely-tuned written content. The tool's key feature is to generate entire ebooks, inclusive of images, within a significantly reduced time span compared to traditional methods. Automateed also has an integrated image creator, powered by AI, which aids authors and designers to create engaging and relevant images for ebook covers or chapter images using simple text prompts. Beyond content and design, the tool assists in concept development with capabilities to suggest niche and subniche topics, title ideas and more. Users will be able to customize the generated book, further enhancing its relevance and appeal to the target audience. Moreover, Automateed comes equipped with marketing capabilities, supporting over 50 tasks associated with high-quality ebook creation. Overall, Automateed provides a comprehensive solution to expedite and improve ebook content creation, design, and marketing. Help other people by letting them know if this AI was useful.",https://automateed.com/?ref=taaft&utm_source=taaft&utm_medium=referral,https://media.theresanaiforthat.com/assets/favicon-large.png,Stefan Mitrovic,5.0,2,Ebooks,"ebook creation, ai writing tool, content generation, design tool, ai image creator, concept development",Free + from $11.25/mo
SEOJuicev2.0,SEO Made Simple — AI-driven internal linking,"Seo Juice is an AI-powered tool designed to automate the process of internal SEO linking for a website. Its fundamental purpose is to ease the burden of manual keyword addition for each new article by using AI to carry out research and generate internal links. Users simply add their domain, and the tool crawls the sitemap and inserts links into the webpage via a simple JavaScript snippet. This technology is intended to save time on keyword research and improve the SEO performance of a site.Seo Juice can be easily integrated into any platform. The installation process involves dropping in a single JS line, which then fetches AI-generated links and replaces them in blog posts, articles or content pages. Deleting unwanted keywords can also be done manually.The tool is designed with the intent of privacy and doesn't gather any user data. It also includes internal reporting features to keep track of inserted links. The AI models used for link and keyword generation are kept up-to-date to ensure the tool remains effective for its users. Pricing is designed to suit different sizes of businesses, and the tool is advertised as being quick to set up and use.Created with a focus on simplicity, Seo Juice requires no contracts and has no hidden fees. While the tool is useful for professionals, it was initially designed to help the creator with their own blog. Ideal for those who want an automated, straightforward approach to internal SEO linking. Help other people by letting them know if this AI was useful.",https://seojuice.io/?ref=taaft&utm_source=taaft&utm_medium=referral,https://media.theresanaiforthat.com/assets/favicon-large.png,Vadim,4.0,4,Internal links,"seo, internal linking, ai in seo, link optimization, keyword research, website crawling",Free + from $9.99/mo
Ren | AI Leadership Coach,"Meet Ren, your AI powered leadership coach.",Help other people by letting them know if this AI was useful.,https://rencoach.com/?ref=taaft&utm_source=taaft&utm_medium=referral,https://media.theresanaiforthat.com/assets/favicon-large.png,Good Authority,5.0,3,Leadership development,"leadership coaching, conversational ai, performance development, team dynamics, personal growth, customizable training data",Free + from $99/mo
Face Swap by BasedLabs,Swap faces in photos with advanced AI.,"BasedLabs.ai | Face Swap is an AI tool that provides a platform for face swapping in images. Users can upload their photos and the AI-powered tool will replace the face in the base image with the face in the targeted image. The resulting image presents seamless results as the AI technology accurately identifies the new face and blends it with the main photo. To use this tool, users are required to upload both base and target images, initiate the face swap, and then preview, download, and share the final product. The tool guarantees security and privacy, as it does not store face information. The user-friendly tool operates swiftly and creates a realistic face swap in mere seconds. In addition to the Face Swap feature, BasedLabs also offers AI-powered solutions for different creative and professional projects such as image-to-text conversion, image upscaling, character generation among others. The platform does not contain any hidden costs, and it can be accessed anytime, anywhere as long as there is an internet connection available. Help other people by letting them know if this AI was useful.",https://www.basedlabs.ai/apps/face-swap?ref=taaft&utm_source=taaft&utm_medium=referral,https://media.theresanaiforthat.com/assets/favicon-large.png,Based AI,4.3,7,Face swap,"face swap, image manipulation, photo editing, privacy protection, image transformation, realistic results",Free + from $19/mo
Mackyv2.0,Get AI Answers for Any Business Question in 30 Seconds,Help other people by letting them know if this AI was useful.,https://macky.ai/?ref=taaft&utm_source=taaft&utm_medium=referral,https://media.theresanaiforthat.com/assets/favicon-large.png,Joseph Tawfik,5.0,1,Business consulting,"consulting, productivity, hr, strategy, emails, blogs",Free + from $17/mo
Netjet.io,Transform your website - The all-in-one AI website generator & builder,"Netjet.io is an all-in-one website generator and builder that leverages artificial intelligence to simplify and optimize the web design process. You can easily generate fully functional website in under 10 seconds. Offering an intuitive drag-and-drop interface, it enables users to create visually stunning and responsive websites without the need for coding skills. Netjet.io comes equipped with built-in search engine optimization (SEO) tools designed to enhance your online visibility. It also provides an array of templates to suit different user needs, making it a versatile tool for web design. Additionally, it features an AI website Generator (https://ai.netjet.cloud/), a tool aimed at instant website generation powered by AI. A 40% recurring revenue affiliate program and various pricing options to cater to different budgets. Moreover, resources such as video tutorials & help, extensive platform and live support. Netjet.io aims to revolutionize the web design experience by combining user-friendliness with AI technology. Help other people by letting them know if this AI was useful.",https://www.netjet.io/en/,https://media.theresanaiforthat.com/assets/favicon-large.png,Matteo,5.0,5,Website building,"website builder, ai technology, drag-and-drop interface, no coding required, search engine optimization, template variety",Free + from $5/mo
PDF Flex,Transform how you engage with documents using Chat PDF.,"Chat PDF is a sophisticated AI tool build by PDF Flex designed to facilitate engagement with PDF files. It provides a conversational interface that allows users to ask questions about a PDF's content, delivering immediate, detailed responses. This feature can simplify research, translation, and content summarization. Besides providing insights, Chat PDF offers extensive document conversion options for both PDF to various formats and diverse formats to PDF, catering to a versatile range of user needs. The tool is also capable of reading entire documents within seconds and generating prompt questions to initiate meaningful interaction with users. Its advanced language model supports multiple languages, breaking down language barriers and rendering it suitable for a global user base. Alongside offering free access and fast performance, Chat PDF prioritizes user convenience and data security. It implements HTTPS encryption to safeguard interactions and doesn't retain the users uploaded files, thus ensuring secure use. Accessible on multiple platforms such as Windows, Mac OS, Linux, iOS, and Android, it extends its usability widely. The tools user-friendly design, high-quality file conversions, and instant response features culminate into a powerful utility for both professional and personal spheres, be it for studying, research or other professional needs. Help other people by letting them know if this AI was useful.",https://pdfflex.com/ai-chat-with-pdf?ref=taaft&utm_source=taaft&utm_medium=referral,https://media.theresanaiforthat.com/assets/favicon-large.png,UNI PDF,4.3,6,Document Q&A,"pdf interaction, conversational ai, document conversion, research tool, machine translation, content summarization",Free
CreateAiCourse,Simplify course creation with the best AI Course Creator.,Help other people by letting them know if this AI was useful.,https://createaicourse.com/?ref=taaft&utm_source=taaft&utm_medium=referral,https://media.theresanaiforthat.com/assets/favicon-large.png,Stefan Mitrovic,5.0,1,Courses,"ai course creation, online education, content generation, e-learning, lesson planning, interactive course",Free + from $49/mo
