Title,Use Cases,Description,Website,Logo,Author,Average Rating,Rating Count,Primary Task,Tags,Price
Durable AI Website Builder,Create a professional website in seconds with AI.,"The Durable AI Website Builder is an artificial intelligence-driven tool that simplifies the process of creating robust and professional business websites. This tool offers features such as automated website generation by providing curated imagery and AI-written content tailored to the specific business need, making it ideal for entrepreneurs, small and medium businesses to establish a compelling online presence. Its intelligent features also include an AI-powered blog builder and brand builder which facilitate automated creation of blog content and brand building initiatives respectively. It is versatile, with components that support a range of industries from digital marketing to pet grooming. As it is hosted through Cloudflare, websites built with this tool can benefit from secure SSL generation, firewalls, and protection from a variety of web attacks, which assures security for user data on the platform. Additionally, the built-in SEO capability of the site generator ensures it's easily discoverable by users on search engines. Also included in the website builder suite are CRM for customer management, invoicing tools, AI assistant for completing administrative tasks, and resources such as guidance and updates from its team. Importantly, Durable is a 'no code' platform, hence completely removes the technical complexity of website creation and modification. Help other people by letting them know if this AI was useful.",https://durable.co/ai-website-builder?ref=taaft&utm_source=taaft&utm_medium=referral,https://media.theresanaiforthat.com/assets/favicon-large.png,Jonathan Johnson,3.5,4,Website building,"ai website builder, automated website generation, business website, ai content creation, professional website, no code",from $12/mo
Taplio,Leverage AI to grow on LinkedIn,Help other people by letting them know if this AI was useful.,https://taplio.com/?utm_source=website&utm_medium=referral&utm_campaign=influ_taaft,https://media.theresanaiforthat.com/assets/favicon-large.png,Alex,4.2,10,Linkedin posts,"ai-powered content creation, linkedin marketing, social media scheduling, viral content inspiration, linkedin analytics, personal branding",Free + from $39/mo
KeywordSearchv2.0,Discover and target YouTube audiences.,"KeywordSearch is an AI-driven marketing tool that helps businesses and content creators to discover their perfect target audience. The platform provides various features, such as AI Audience Builder, Keyword Research, Keyword Topic Auto Expansion, and YouTube Ad Spy. The AI Audience Builder helps users create high-performing ad audiences in one click using an AI algorithm that analyzes the audience data, identifies hidden patterns, and uncovers relevant and high-performing audiences for Google and YouTube ad campaigns. Users can effortlessly sync audiences to Google and YouTube ads in one click, saving time and improving ROI with automated audience creation and expansion.The Keyword Research feature helps users discover the best keywords to grow their YouTube channel and ads, while the Keyword Topic Auto Expansion feature empowers content creation and channel growth with tailored recommendations for new video ideas, titles, tags, and optimized descriptions.The YouTube Ad Spy feature offers access to a vast database of YouTube ads, their statistics, metadata, and targeting insights, helping users stay informed about industry trends, uncover successful ad strategies, and benchmark their campaigns against top performers to optimize their marketing efforts and drive results.KeywordSearch is trusted by top leaders in various industries and offers resources such as a blog and training academy to help users stay on top of audience discovery and targeting best practices. Help other people by letting them know if this AI was useful.",https://www.keywordsearch.com/?ref=taaft&utm_source=taaft&utm_medium=referral,https://media.theresanaiforthat.com/assets/favicon-large.png,Aleric Heck,5.0,4,YouTube keyword search,"youtube, keyword, search, analysis",Free + from $97/mo
Caktus,Automated school work assistance for students.,"Caktus is an educational artificial intelligence (AI) tool that automates school work, allowing students to save time and do the things they love. It offers a range of AI-driven services such as an Essay Writer, Paragraph Generator, Discussion Questions, Personal Statement Writer, YouTube to Essay, Text Summarizer, and a range of coding writers for Python, Java, C#, Javascript, and Go. It also features a Career section with Cover Letter and Resume Bullet Points writers. Caktus also has a Scholarship program to help students enrich their education. All of these features are designed to make school work easier and help students make the most of their time. Help other people by letting them know if this AI was useful.",https://www.caktus.ai/caktus_student?ref=taaft&utm_source=taaft&utm_medium=referral,https://media.theresanaiforthat.com/assets/favicon-large.png,Harrison Leonard,2.0,4,Writing,"text, writing, articles, code, programming",Free + from $24.99/mo
Audioread.com,"Listen to articles, PDFs, emails, etc. in your podcast player or browser.","Audioread is an AI-based tool that provides ultra-realistic voices for listening to web articles, PDFs, emails, and various other types of content. The tool can be used in a podcast app or browser, allowing users to seamlessly convert text into audio while performing their daily activities, such as exercising, cooking, commuting, or running errands. Users can also forward emails, drag/drop PDFs, copy/paste text, or highlight it. Audioread offers several listening options, including the ability to create and subscribe to a personal podcast, with compatibility for leading podcast apps such as Apple Podcasts, Google Podcasts, and Overcast. Alternatively, users can listen to the converted audio directly in the browser. The tool provides a free trial, and the paid version offers unlimited word conversions per day, up to 18 languages, and can convert 100,000 words per conversion for a monthly subscription of $15. Audioread has earned positive youtube users such as Thomas Frank, and has been recommended in articles like The Age of AI Has Begun on gatesnotes.com. Users concerned about the amount of time it takes to read long articles, PDFs, and emails will appreciate Audioread for allowing them to listen to content while they perform other activities. Help other people by letting them know if this AI was useful.",https://audioread.com/?ref=taaft&utm_source=taaft&utm_medium=referral,https://media.theresanaiforthat.com/assets/favicon-large.png,Eric J,3.4,5,Text to speech,"text, reading, audio, productivity, speech, podcast",from $19.99/mo
AI Course Creator,Assisted mini-course creation with technology.,"The AI Assistant tool by Mini Course Generator simplifies the process of creating mini-courses by using artificial intelligence to suggest titles and outline suggestions based on a provided description. Once you select your preferences, the tool generates a complete and highly accurate mini-course that you can edit and personalize with questions, images, videos, customized completions, and more. You have complete control over the mini-course, from title selection to determining the outline, and can guide the AI Assistant to create content that aligns with your vision. Additionally, the tool provides versatile capabilities to edit and share the mini-course in the same platform, making the entire process seamless. Mini Course Generator offers different options for presenting and distributing the mini-course, such as embedding it on webpages, sharing it with customizable links, using it as lead magnets to collect emails, adding exclusivity to the content via a password wall, and monetizing know-how with a payment wall. The tool also allows you to enhance the content by adding interaction through quiz and survey questions, customizing appearance according to branding, and adding gateways depending on educational or marketing goals. Overall, the AI Assistant tool by Mini Course Generator saves significant time and energy by streamlining the process of creating engaging and distinctive mini-courses with the help of artificial intelligence. Help other people by letting them know if this AI was useful.",https://minicoursegenerator.com/ai-assistant/?ref=taaft&utm_source=taaft&utm_medium=referral,https://media.theresanaiforthat.com/assets/favicon-large.png,Unknown Author,3.3,3,Courses,"learning, studying",Free + from $15/mo
Kiwi Video,Video learning with summary and quiz features.,"Kiwi is an AI-powered tool that helps users learn from videos. It allows users to ask questions and get summaries of the content they are watching. Users can also quiz themselves on the video's content. Kiwi is designed to be used with various types of video content, such as TEDx Talks and educational videos on engineering and science. The tool works by breaking down the video's content and using natural language processing to understand the information being conveyed. Kiwi then generates a summary of the video and creates quiz questions based on the content. Users can interact with Kiwi through a user-friendly interface that allows them to type in questions or click on a button to summarize or quiz themselves. Kiwi's focus on using AI to improve learning from video content can be a valuable tool for students and anyone looking to enhance their knowledge of a particular subject. The tool's ability to provide summaries and quiz questions can save users time and help them retain the material more effectively. Kiwi's interactive interface ensures that users can easily engage with the tool and get the most out of their learning experience. Help other people by letting them know if this AI was useful.",https://kiwi.video/?ref=taaft&utm_source=taaft&utm_medium=referral,https://media.theresanaiforthat.com/assets/favicon-large.png,Unknown Author,3.7,3,Video summaries,"video, summary",No price available
LogoAi,Platform for creating professional brand identities.,"LogoAI is a brand building platform designed to make it easy to create professional logos, design matching identities, and automate brand promotion. It has an AI-powered engine that understands logo data, design best practices and brand building principles. LogoAI provides logo designs in all sizes and formats, plus matching stationery, business cards, social media content, posters and flyers. It offers a range of logo ideas and templates that can be customized to meet individual needs. The platform also has a brand center to quickly activate a personalized brand package. LogoAI offers a way to build a professional brand with ease and speed. Help other people by letting them know if this AI was useful.",https://www.logoai.com/?ref=taaft&utm_source=taaft&utm_medium=referral,https://media.theresanaiforthat.com/assets/favicon-large.png,Unknown Author,2.4,5,Logo design,"image, design, logo",from $29/mo
FineCam,Simplifies video production and enhances quality.,"FineShare FineCam is an AI-powered virtual camera software designed to make video production easier. It features the ability to turn your iPhone into a 4K HD webcam, removing webcam background, adding webcam effects and color, multi-scenes, brand logo, and overlay. It works with all your favorite video calling and streaming apps such as Zoom, Microsoft Teams, Twitch, OBS, Adobe Premiere Pro, etc. It allows you to capture one shot from multiple angles, seamlessly switch between lenses, change video resolution, and more. FineCam also provides AI enhancement, auto focus, advanced adjustment, and webcam effects to make your video look more cinematic without effort. It also allows you to use PowerPoint slides, YouTube videos, and web pages as a virtual background. Furthermore, FineCam works with Unsplash to offer millions of stunning video background scenes, and provides pre-made branding templates to create a perfect branding design. It also leverages deep learning to perform real-time video processing, background subtraction algorithms, low light video booster, and Gaussian blur. Help other people by letting them know if this AI was useful.",https://www.fineshare.com/finecam/?ref=taaft&utm_source=taaft&utm_medium=referral,https://media.theresanaiforthat.com/assets/favicon-large.png,VIKI89,3.0,2,Video editing,"video, edit, camera",from $9.95/mo
Kaiber,AI Video Generation,"Kaiber is an innovative AI tool designed for video generation. Leaning on artificial intelligence, it simplifies and streamlines the process of creating engaging video content. Kaiber is able to analyze text-based information and transform it into captivating and relevant video sequences. This tool goes beyond simply merging and rearranging video clips. It employs advanced AI algorithms for data interpretation and content creation, ensuring that the final output aligns closely with the input details and expectations. The ultimate product is not just visually appealing, but also contextually accurate and resonant with the intended audience. Note that to run this tool, users need to have JavaScript enabled on their devices. Suitable for various use cases including marketing, education, and content creation, Kaiber is a versatile solution that makes video generation easier and more efficient. Despite playing in a complex technological area, it excels in user-friendliness, meaning even non-tech-savvy individuals can leverage it for their video content needs. Help other people by letting them know if this AI was useful.",https://kaiber.ai/?ref=taaft&utm_source=taaft&utm_medium=referral,https://media.theresanaiforthat.com/assets/favicon-large.png,Unknown Author,3.5,25,Videos,"video generation, content creation, ai video tool, data interpretation, audience targeting, marketing",Free + from $5/mo
Mindsmithv2,Platform for building and sharing eLearning content,Help other people by letting them know if this AI was useful.,https://www.mindsmith.ai/?ref=taaft&utm_source=taaft&utm_medium=referral,https://media.theresanaiforthat.com/assets/favicon-large.png,Ethan Webb,5.0,13,Courses,"learning, education, training, teaching, elearning, course creation",Free + from $39
QuickVid,Quick creation of engaging YouTube shorts.,"QuickVid is an AI-powered tool for quickly creating engaging YouTube shorts. It enables users to generate unique, brand-focused videos with an AI-powered editing tool that is 10 times faster than manual video production. The tool has a library of templates that can be used to create videos quickly and easily, and it can also be used to customize existing templates to create unique videos for any brand. QuickVid also has an AI-driven video editor that can be used to make edits to videos in real-time. The tool can be used to generate videos in any language, and it also has a range of features such as text-to-speech, voice recognition, and facial recognition that can be used to create more engaging videos. Overall, QuickVid is a powerful tool for creating professional-looking videos in an efficient and cost-effective manner. Help other people by letting them know if this AI was useful.",https://www.quickvid.ai/?ref=taaft&utm_source=taaft&utm_medium=referral,https://media.theresanaiforthat.com/assets/favicon-large.png,Unknown Author,2.6,5,YouTube shorts,"youtube, video, generator",from $20/mo
Easy-Peasy.AI,Accelerates content creation.,Help other people by letting them know if this AI was useful.,https://easy-peasy.ai/?ref=taaft&utm_source=taaft&utm_medium=referral,https://media.theresanaiforthat.com/assets/favicon-large.png,Dmytro,4.2,5,Content,"text, writing",Free + from $4.99
Browse AI,Monitored website data extracted.,"The Scrape and Monitor Data from Any Website with No Code tool allows users to monitor any website for changes and extract specific data from websites as a spreadsheet without the need for coding. It operates as a robot that can be trained within 2 minutes, making it quick and easy to use. The tool allows users to set up prebuilt robots for popular use cases or create custom APIs for websites that do not have public APIs available. Users can extract data behind login, handle pagination and scroll, and download files. Additionally, the tool emulates user actions, solves captchas, and provides geolocation-based data. Users can schedule data extraction and get notified of any changes made to the targeted website. The tool offers flexible pricing plans and has been recommended by over 101,000 individuals and teams, including companies such as Accenture, Hubspot, and Amazon. Browse AI provides prebuilt robots for popular websites, including LinkedIn, Eventbrite, ProductHunt, Indeed, Google Workspace, Zapier, Realtor, Yelp, Redfin, Monster, Glassdoor, Upwork, FlexJobs, Seek, Remoteok, Clutch, eBay, and TikTok. The tool can extract job postings, product lists, company details, event details, and other relevant data from these websites. Overall, the tool offers an effective and efficient way to monitor websites and extract data without the need for coding expertise. Help other people by letting them know if this AI was useful.",https://www.browse.ai/?ref=taaft&utm_source=taaft&utm_medium=referral,https://media.theresanaiforthat.com/assets/favicon-large.png,Unknown Author,1.0,1,Webscraping,"data, website, extract, scrape",Free + from $19/mo
Deepmotion,3D animations,"DeepMotion is an AI-powered motion capture and real-time body tracking tool that enables users to generate 3D animations from videos through any web browser. The tool offers four products - Animate 3D, Real-Time Body Tracking, Virtual Reality Tracking, and Motion Brain - each of which caters to different animation requirements. Animate 3D generates 3D animations from videos, while Real-Time Body Tracking offers the ability to capture and reconstruct 3D full body motion. Virtual Reality Tracking provides immersive full-body avatars using minimal trackers, and Motion Brain transforms digital beings from animated to alive. DeepMotion's technology is powered by AI and markerless motion capture, making it an industry-leading web and mobile solution for creating and animating digital characters. The team is led by industry veterans with years of experience from companies like Blizzard, Pixar, and Disney, working towards their mission of leading the field of Motion Intelligence. DeepMotion has partnered with leading companies like Samsung, Qualcomm, Nvidia, and Intel to provide optimized performance and better user experience. Users can try the tool for free or contact the sales team for more information. Help other people by letting them know if this AI was useful.",https://www.deepmotion.com/?ref=taaft&utm_source=taaft&utm_medium=referral,https://media.theresanaiforthat.com/assets/favicon-large.png,Unknown Author,3.5,2,3D animations,"motion capture, real-time tracking, 3d animation, ai powered, virtual reality, motion intelligence",Free + from $9/mo
Football AI,Predicting football match results with data analysis.,"Football AI is a machine learning based football prediction app developed by Cookie App Factory. The app uses a unique algorithm that analyses over 1000 data points to predict football match outcomes. The algorithm analyzes data ranging up to 7 years, including form, past meetings, squad quality, injuries, whether the match is played on the home court or as guests, formation of the team, scored goals, rookies and current points in the table. The app provides tips in 1, X, 2 formats along with full slip predictions. It is constantly updated to improve its prediction accuracy and has an 85% success rate in predictions. Football AI claims to compete against the bookmakers' prediction system and aims to provide users with better predictions. The app has over 1 million downloads with a PEGI 18 rating and includes in-app purchases. The developers declare that no personal data is shared with third parties and the app encrypts data during transit. The app collects personal info, messages, and app activity, which can be deleted upon request. The ratings and reviews of Football AI are verified and are mostly positive, with users claiming that the app provides reliable and accurate football match predictions. Help other people by letting them know if this AI was useful.",https://play.google.com/store/apps/details?id=com.footballscore.mobile&ref=taaft&utm_source=taaft&utm_medium=referral,https://media.theresanaiforthat.com/assets/favicon-large.png,Unknown Author,4.4,7,Football predictions,"football, predictions",Free + from $2/mo
Vizologi,Boost your business strategy with limitless ideas and insights.,"Vizologi is an Artificial Intelligence-based tool designed to boost business strategy. The tool serves as a business plan generator, automating the crafting of business plans to save users time and provide insightful analysis. Vizologi aids users in generating an unlimited number of business ideas, offering a platform for brainstorming. It is equally efficient in providing insights on markets and competitors, thereby facilitating business intelligence. It uses Artificial Intelligence to accelerate the process of business plan creation, including elements such as research, market analysis, business design, and prototyping. An additional benefit of using Vizologi is the accessibility to a knowledge base, hence aiding in the identification of new business opportunities. Furthermore, this AI expert has been trained on strategies from leading companies, enhancing its capability to deliver accurate analytics and comprehensive feedback. Vizologi proves useful to a wide array of professionals including strategists, creatives, consultants, entrepreneurs, managers and students, thus making it a versatile tool. Help other people by letting them know if this AI was useful.",https://vizologi.com/?ref=taaft&utm_source=taaft&utm_medium=referral,https://media.theresanaiforthat.com/assets/favicon-large.png,Unknown Author,0.0,0,Business intelligence,"businessstrategy, businessplangenerator, businessintelligence, marketanalysis, competitiveanalysis, artificialintelligence",Free + from $9/mo
Cleanup pictures,"Remove objects, people, text, defects from any picture for free","Cleanup.pictures is a tool that uses artificial intelligence to remove unwanted objects, people, text, and defects from any image. This tool is useful for a variety of use-cases and industries. Photographers can use it to remove time stamps or unwanted elements from images before printing them. Creative agencies can leverage this tool to create stunning visuals and remix existing photos. Real estate agents can remove unwanted objects or personal items from property photos to help them portray a home or apartment in the best light possible. E-commerce businesses can use it to create perfect product shots by removing any undesired aspects. There is also functionality to remove text, logo, watermarks, or date stamps. The tool also offers API for product integration. Cleanup.pictures is free to use, but paid packages are available for handling high-resolution images or for when higher quality processing is needed. The tool's inpainting technology makes it stand out from other clone stamp tools as it is able to estimate what was originally present behind unwanted text or objects. Help other people by letting them know if this AI was useful.",https://cleanup.pictures/?ref=taaft&utm_source=taaft&utm_medium=referral,https://media.theresanaiforthat.com/assets/favicon-large.png,Unknown Author,3.5,4,Image editing,"image editing, photo correction, object removal, ai enhancements, watermark removal, ai technology",Free + from $3
AdCreative.ai,Empowering your advertising with AI.,"AdCreative.ai is an AI-powered advertising platform designed to provide services ranging from the generation of conversion-focused ad creatives to comprehensive competitor insights. Relevant for all businesses, from startups to large enterprises, this tool is a hub for data-driven advertising strategies. Its suite includes tools for generating impactful ad texts and visuals, aimed to make advertising campaigns stand out in a highly competitive market. Users can generate hundreds of ads, test and find the best-performing ones and automate these processes for more efficient strategies and enhanced conversion rates. The platform is also capable of generating product photoshoots through AI, minimizing the practical constraints of traditional photoshoots. One of the significant aspects of AdCreative.ai is its ability to score ad creatives. Users can score their ad creatives, giving them insights into their potential performance before launch. This capability makes the iterative process of developing high-performing advertisements faster and more targeted. Furthermore, the platform provides an analysis of competitors' top-performing ads which enables users to refine their own advertising strategies effectively. In summary, AdCreative.ai is a comprehensive, AI-powered tool for creating, testing, and refining ad campaigns based on data and competitor performance for improved business outcomes. Help other people by letting them know if this AI was useful.",https://www.adcreative.ai/?ref=taaft&utm_source=taaft&utm_medium=referral,https://media.theresanaiforthat.com/assets/favicon-large.png,Unknown Author,2.6,5,Content,"ai advertising, conversion rates, ad creation, ad testing, ad automation, competitor insights",Free + from $15/mo
