Title,Use Cases,Description,Website,Logo,Author,Average Rating,Rating Count,Primary Task,Tags,Price
UI Copilot,"AI-powered UI feedback, instantly","UI Copilot is an AI-powered design assistant offered as a Chrome extension that provides insightful and objective feedback on the user interface (UI) of any website. Its primary functionalities include the ability to capture any part of a website and receive immediate, actionable design guidelines based on AI analysis. The tool provides tips on improving website layouts, color schemes, typography, etc. To use UI Copilot, users simply activate it from the Chrome toolbar, capture the desired portion of a website, and the tool provides a detailed list of design recommendations. This tool can be used on both public websites and localhost, as well as development servers. UI Copilot was developed with a broad range of users in mind - from professional designers seeking a second opinion, developers aiming to enhance their UI skills, or anyone interested in understanding good design practices. Furthermore, the extension is designed to be a learning tool, encouraging users to learn design principles as they browse the web. UI Copilot employs Google Gemini LLM models to deliver these features. An important note for users is that UI Copilot is free during its beta stage, providing almost unlimited feedback requests. The developers encourage users to provide feedback to help shape the future development of the tool. Help other people by letting them know if this AI was useful.",https://chromewebstore.google.com/detail/ui-copilot/hgaldpfdgmmojgdlaiapgndeicgdbldp?ref=taaft&utm_source=taaft&utm_medium=referral,https://media.theresanaiforthat.com/assets/favicon-large.png,Unknown Author,0.0,0,UI design feedback,"ui design, design feedback, chrome extension, ai analysis, design assistant, website layout",No price available
GuideToGo,Your Ultimate AI-Powered Travel Companion,"GuideToGo serves as an AI-powered travel companion designed to enhance travel experiences. It functions as an intelligent mobile tourist guide, providing users with comprehensive information about different tourist destinations. This tool is suitable for exploring iconic landmarks and hidden attractions alike, offering answers to user queries at their fingertips. GuideToGo maintains a vast database, covering detailed information on numerous locations globally. From major cities to less-trodden paths, users can access a wealth of knowledge about different locations. The AI technology of GuideToGo offers instant responses to any queries about selected destinations. It also recommends unique local spots and attractions based on user interests, personalizing the exploration experience. The user-friendly interface of GuideToGo ensures an intuitive and simple navigation experience, making users feel confident and comfortable when using the guide. GuideToGo eliminates the need for expensive tour guides and strict schedules, allowing users to control their travel adventure. Notably, the app's privacy practices signify that the developer does not collect any data from the app. Help other people by letting them know if this AI was useful.",https://apps.apple.com/us/app/guidetogo-ai-gps-audio-guides/id6503728729?ref=taaft&utm_source=taaft&utm_medium=referral,https://media.theresanaiforthat.com/assets/favicon-large.png,Unknown Author,0.0,0,Travel guides,"ai travel guide, tourist attractions, ai personalization, global destinations, travel navigation, expensive tour guides",Free
Broccoli AI,AI coach for guided running workouts.,"Broccoli AI is an AI-powered running coach application designed to enhance your training sessions. This application uses audio to guide the user through their workouts, providing feedback regarding workout intensity and motivation, ensuring an effective, engaging experience. Leveraging its AI capabilities, Broccoli can time interval starts and provide real-time updates to keep you on track and within the optimal exercise zone. The application's flexibility integrates seamlessly into your existing workflow, eliminating the need to change the apps you currently use for workout tracking. The app presents a feature of connecting a heart rate monitor, which leads to personalized training. Broccoli AI presents a Premium subscription model for added benefits and features, while it continues to offer the basics to its users for free. The tool incorporates privacy practices that may vary depending on the feature usability or the user's age. This coaching tool amplifies its versatility by allowing users to choose between indoor and outdoor runs. Additionally, the privacy practices promise data confidentiality, ensuring a secure and user-friendly environment. Help other people by letting them know if this AI was useful.",https://apps.apple.com/us/app/broccoli-ai/id6575387572?ref=taaft&utm_source=taaft&utm_medium=referral,https://media.theresanaiforthat.com/assets/favicon-large.png,Unknown Author,0.0,0,Running coach,"ai coach, running workouts, training sessions, audio guidance, workout feedback, motivation",Free + from $14.99/mo
ImageChat,Create stunning AI images directly in WhatsApp,"ImageChat is an artificial intelligence (AI) tool that allows users to generate and modify images directly through the WhatsApp interface. The AI technology integrated within this tool lets users create stickers, transform their selfies, and generate other unique image content. This tool allows for convenient creation and sharing of AI images with no need for additional downloads or software installation. The user-friendly interface and seamless integration with WhatsApp make it accessible and easy to use for users of all technical backgrounds. The instant generation feature of ImageChat aids in crafting creative content in seconds. Advanced features and models for AI-image generation are also available, providing a range of customisations and options for the created images. The images generated can be upscale or restored, depending on the user's preference. It also comes with an array of options to suit various needs, from entry-level usage to more intricate functions for small businesses. It should be noted that ImageChat aims to foster creativity through the unique confluence of AI and image creation. Help other people by letting them know if this AI was useful.",https://www.chatworks.nl/image-chat?ref=taaft&utm_source=taaft&utm_medium=referral,https://media.theresanaiforthat.com/assets/favicon-large.png,Unknown Author,0.0,0,Whatsapp images,"ai-image generation, whatsapp integration, image modification, sticker creation, selfie transformation, instant generation",from $3.28
Vidu AI,Transform ideas into stunning videos with AI,"Vidu AI is an artificial intelligence-based tool specialized in high-quality video generation from the provided text and images. A distinguishing characteristic of this tool is its capability to automate video creation process, making it both efficient and cost-effective. The AI foundation allows Vidu AI to learn and evolve continuously, leading to quality improvement of the output with time. Furthermore, Vidu AI offers a diversity of applications, making it suitable for industries like marketing, education, and social media. Creating videos is intuitive with Vidu AI, as it accepts text, images or a combination of both as input for the desired video. This feature provides expressive and creative freedom in video creation to match specific needs. Vidu AI doesn't require any video editing experience or technical skills, as it is designed for both individual creators and professionals. The video generation with Vidu AI typically takes a few minutes, depending upon the complexity of the input, significantly reducing the timeframe when compared to traditional video production methods. The tool emphasizes creating unique and high-fidelity videos, offering customization for mass personalization. It is ideal for those looking to minimize expenses on professional video equipment and production teams. Help other people by letting them know if this AI was useful.",https://viduai.ai/?ref=taaft&utm_source=taaft&utm_medium=referral,https://media.theresanaiforthat.com/assets/favicon-large.png,Unknown Author,0.0,0,Videos,"video generation, video editing, automated video creation, cost effectiveness, continuous learning, marketing",No price available
Amabay,Your AI ambassador for global queries,"Amabay is an AI tool designed to handle queries reliably and efficiently. It primarily functions as an AI ambassador, capable of answering global questions and generating precise responses. The tool allows users to create an AI bot, called 'Amabot', in a manner that is intuitive, interactive, and swift. The Amabot acts as a virtual spokesperson for the user or organization, designed to provide quick and efficient query response services. Amabay leverages a technology known as 'RAG', which utilizes personal information input by the user to generate objective answers. This technology allows the Amabot to provide personalized responses based on the Real You input by the users about themselves. This feature makes Amabot ideal for various use cases such as locating collaborations, identifying job opportunities, friend-finding, and even seeking a soulmate. Additionally, organizations can use Amabay for efficient handling of frequently asked questions, thus providing robust customer support. Amabay also offers a unique way for individuals to showcase themselves by allowing anonymous AMAs and letting others learn about them and discover their interests. Users can keep track of recent bot visits, received questions, and reach out to people who interest them. It features a simple set-up process, where users can upload their personal information or paste links about themselves to create their own Amabots. Users can then share their bot link for others to interact with their Amabots. Help other people by letting them know if this AI was useful.",https://www.amabay.ai/?ref=taaft&utm_source=taaft&utm_medium=referral,https://media.theresanaiforthat.com/assets/favicon-large.png,Unknown Author,0.0,0,Chatbots,"query handling, customer support, global queries, interactive chatbot, ai ambassador, personalized responses",Free
Quick Resume,AI-powered resumes in seconds,"Quick Resume is an AI-powered tool designed to generate professional resumes/CVs quickly using advanced AI models. Quick Resume simplifies the resume creation process where users choose the type of resume required (such as 'Software Engineer', 'Casual', or 'Targeted Job'), and then input personal information, work capacities, educational qualifications, and competencies in specific fields. The AI model creates a resume from the submitted data. Upon payment, users can download their created resume in PDF or LaTeX formats. The delivered resumes can be edited, particularly in LaTeX format, if users wish to make modifications. Quick Resume uses Google Gemini AI, applying algorithms to ensure the creation of standout resumes while considering the competitive job market. Two of the main format options, LaTeX and PDF, are available to cater to differing needs. LaTeX, a document preparation system used for high-quality typesetting, is perfect for creating professional documents that can also be further refined by users. Meanwhile, the PDF format is ready for instant usage. Another significant aspect is the ATS (Applicant Tracking System) friendliness of created resumes. ATS is a prevalent system used by numerous corporations for filtering resumes based on certain keywords, and Quick Resume is designed with this feature in mind ensuring increased visibility in the applicant pool. Help other people by letting them know if this AI was useful.",https://quickresume.co/?ref=taaft&utm_source=taaft&utm_medium=referral,https://media.theresanaiforthat.com/assets/favicon-large.png,Unknown Author,0.0,0,Resumes,"ai-powered, resume builder, pdf format, latex format, ats friendly, editable resume",from $5
FileAI,Automate document analysis and data extraction.,"FileAI is an AI-powered tool designed to automate document analysis and extract relevant data, particularly useful in sectors such as finance, legal, research, and academia. With a primary focus on streamlining workflows, users have the ability to upload multiple files and execute instant queries. In the context of structured documents like financial statements, legal documents, and research papers, FileAI is able to extract specific data points. It can automate the review of contracts to identify key clauses, deadlines, and compliance requirements and assist with financial report preparation by aggregating data from diverse financial documents. For the academic sector, it enhances learners' and researchers' process by summarizing complex texts, extracting key information, and enabling plagiarism detection. The tool also offers support for legal research, efficiently pulling out relevant case laws, statutes, and precedents from legal documents and databases. Regarding data privacy, any data collected by FileAI is for its immediate and specific purpose, and it is noted that AI's version of user files are deleted after seven days of non-use. Help other people by letting them know if this AI was useful.",https://fileai.pro/?ref=taaft&utm_source=taaft&utm_medium=referral,https://media.theresanaiforthat.com/assets/favicon-large.png,Unknown Author,0.0,0,Document analysis,"document analysis, data extraction, workflow automation, multi file upload, query execution, structured documents",Free + from $9.90/mo
RoastLinkedIn,Get a hilarious roast of your LinkedIn profile,"RoastLinkedIn.com is an AI-powered tool designed to generate 'roasts' or critiques of LinkedIn profiles with the aim of helping users improve their online professional presence. The tool works by a user entering the URL of a LinkedIn profile and the AI analyses the profile. The analysis results in humorous 'roasts' of aspects of the profile that need improvement and provides 'spicy tips' for enhancement. The tool focuses on critiquing main aspects of the profile, such as the profile picture and the summary section of the LinkedIn page to help the user stand out. Examples of roasts provided include comments about the profile picture or the length of the summary, adding a touch of humor to constructive feedback. RoastLinkedIn.com also boasts multilingual support, extending its services to users from different non-English speaking regions, suggesting it offers a broad relevance. This tool is a part of the AIApply platform, suggesting that it may also integrate with other job search automation tools. Help other people by letting them know if this AI was useful.",https://roastlinkedin.com/?ref=taaft&utm_source=taaft&utm_medium=referral,https://media.theresanaiforthat.com/assets/favicon-large.png,Aidan Cramer,5.0,1,Linkedin profile roasts,"linkedin profile review, ai humor, constructive feedback, profile enhancement, job search tools, ai roasting",Free
Mackyv2.0,Get AI Answers for Any Business Question in 30 Seconds,Help other people by letting them know if this AI was useful.,https://macky.ai/?ref=taaft&utm_source=taaft&utm_medium=referral,https://media.theresanaiforthat.com/assets/favicon-large.png,Joseph Tawfik,5.0,1,Business consulting,"consulting, productivity, hr, strategy, emails, blogs",Free + from $17/mo
AI Detector Online,Spot AI-generated content with ease,"AI Detector serves as a comprehensive set of tools for identifying content generated or manipulated by artificial intelligence (AI). This platform is adept at detecting AI-produced text or visual content, making it useful for maintaining the originality and authenticity of content in various domains. The AI Detector features several specialized tools - the AI Content Detector, AI Text Detector, AI Writing Detector, AI Generated Text Detector, and AI Art Detector.The AI Content Detector identifies text created by AI, thereby assisting in verifying content's originality. It offers detailed detection reports and is designed with the highest security measures to maintain the privacy and integrity of the content being examined.The AI Image Detector analyzes images to determine if they have been created or manipulated by AI. It helps in maintaining the integrity and authenticity of visual content by providing comprehensive image analysis reports.The toolset includes an 'Undetectable AI generator' which ensures texts, articles and books are free from AI-generated content. It also provides a sentence rewriter that helps in enhancing the authenticity of business documents.AI Detector is suited to a variety of situations where content authenticity is crucial such as verifying the authenticity of academic papers or ensuring business reports have not been AI-manipulated. With a strong emphasis on data security and privacy, AI Detector makes sure all information is handled securely and confidentially. The service also provides a 24/7 support team to assist users with any issues related to its detection tools. Help other people by letting them know if this AI was useful.",https://ai-detector.online/?ref=taaft&utm_source=taaft&utm_medium=referral,https://media.theresanaiforthat.com/assets/favicon-large.png,Unknown Author,0.0,0,AI content detection,"ai detection, content verification, image analysis, data security, ai generated text identification, content authenticity",Free
AI The Name,Generate unique names with meaning in one click,"AI Name Generator is a versatile tool that uses AI systems to create unique names for various contexts and categories. It is useful for creating names for business projects, characters, pets and more. Names generated by this tool come with a detailed interpretation of their meanings, providing deeper insight into their significance. Types of names generated include Funny Names, Baby Names, Game Nicknames, Theme Names, among others. Each category aligns with the type of name one wants to generate. For example, Game Nicknames may inspire representations of players' characters based on the meanings derived from the names. The AI Name Generator also provides specialty generators such as the Theme Generator for party themes and Reader Name Generator for literary interpretations. User-friendly and creative, this tool also offers name generators based on gender like boy name generator, girl name generator and gender-neutral name generator. Additionally, the AI Name Generator provides a variety of culturally specific name generators, such as Brazilian, Chinese, Dutch. This innovative tool offers a comprehensive package, meeting manifold naming needs across different contexts, themes, and cultures. Help other people by letting them know if this AI was useful.",https://aithename.com/en?ref=taaft&utm_source=taaft&utm_medium=referral,https://media.theresanaiforthat.com/assets/favicon-large.png,Unknown Author,0.0,0,Names,"ai technology, name generation, business naming, character naming, pet naming, cultural name generation",Free
Cheerlink,AI-powered inbox that boosts conversions and delights customers.,"Cheerlink is an AI-powered tool designed to enhance customer engagement and increase sales conversions. The tool integrates with websites and platforms like Shopify to offer a more dynamic customer experience. Key functionalities include proactive interaction with website visitors and instant support to customer inquiries, which may help in driving sales. Cheerlink can centralize customer inquiries through its AI inbox, which comes with an AI shop assistant to improve shopping experiences. It incorporates AI technology for tasks such as summarizing customer conversations and suggesting replies, thus potentially improving the efficiency of customer support. Additionally, it offers capabilities to personalise its appearance according to the brand, and supports multiple languages to cater to a global user base. It can be easily set up, requiring minimal coding knowledge, and provides mobile-friendly features. Users have lauded its ease of customization, multilingual support, and effective conversational AI capabilities that aid in customer engagement and conversion. Help other people by letting them know if this AI was useful.",https://www.cheerlink.app/?ref=taaft&utm_source=taaft&utm_medium=referral,https://media.theresanaiforthat.com/assets/favicon-large.png,JIN QIU,5.0,6,Customer engagement,"ai customer support, sales conversions, ai inbox, ai shopping assistant, customer engagement, website integration",from $4/mo
QuickMagic,"High-quality mocap from any video, anywhere.","Quick Magic Mocap is a versatile AI-powered mocap (motion capture) tool designed to match the quality of traditional optical mocap systems, without the requirement of specialized cameras or specific studio settings. The tool streamlines the process of capturing high-quality motion data simply by importing a video, making it a quick and efficient solution for motion capture data extraction. This tool has applications across multiple fields including film production, game development, and virtual reality industries. A standout feature of Quick Magic Mocap is its ability to aid users in creating high-quality animations in an expedited manner, with a distinct focus on precision. The AI-driven process eliminates the constraints of traditional mocap methods, making it a flexible and accessible solution for a wide range of motion capture needs. Help other people by letting them know if this AI was useful.",https://www.quickmagic.ai/?ref=taaft&utm_source=taaft&utm_medium=referral,https://media.theresanaiforthat.com/assets/favicon-large.png,QuickMagic,5.0,2,Motion capture,"mocap, motion capture, video import, ai-powered, film production, game development",Free + from $9.9/mo
Calvin - AI Shorts Maker,Effortless video creation like never before with AI.,"Calvin - AI Shorts Maker is an intuitive application software, designed to simplify the process of creating short videos. It employs Artificial Intelligence (AI) to turn ideas into engaging video content. The users need to verbalize their concept, and the AI transforms it efficiently and accurately into visual content, eliminating the need for complex manual editing. Calvin embodies a unique interplay of human and AI interface, referred to as 'Humanion,' aiming to streamline and enrich the video-making experience. In other words, Calvin acts as your personal AI video editor. This tool is particularly well-suited for social media enthusiasts, influencers, content creators or anyone looking to create impactful and shareable video content without the complexities typically associated with the video editing process. The app also offers a built-in community feature where users can connect with a network of creative individuals. The platform already has a large user base and its capabilities have been praised by its active users. The testimonials suggest a high degree of user satisfaction with respect to the ease of usage and efficiency of the application. The tool can be downloaded from the relevant app store. Help other people by letting them know if this AI was useful.",https://www.humanion.ai/calvin?ref=taaft&utm_source=taaft&utm_medium=referral,https://media.theresanaiforthat.com/assets/favicon-large.png,Gökhan Yahya Torba,5.0,4,Short videos,"video editing, content creation, social media tool, video content, ai video editor, short video creation",Free + from $24.99/mo
Langtrace AI,"Monitor, evaluate & improve your LLM apps","Langtrace AI is a comprehensive toolset for monitoring, evaluating, and optimizing large language models (LLMs). It is designed to enhance AI applications by providing real-time insights and comprehensive performance metrics. As an open-source observability tool, Langtrace collects and analyzes traces and metrics with the aim of enhancing LLM apps. Capable of ensuring high-level security, it is SOC 2 Type II certified for robust data protection. A notable feature of Langtrace is its simple and non-intrusive setup, which can be accessed via its Software Development Kit (SDK). Langtrace supports popular LLMs, frameworks, and vector database including OpenAI, Google Gemini, and Anthropic among others. Its core capabilities range from end-to-end observability of your machine learning pipeline, to the creation of golden datasets with traced LLM interactions for continuous testing and enhancement of AI applications. It also facilitates the comparison of performance across different models and tracking of cost and latency at various levels. Langtrace AI's community-driven nature ensures the coexistence of open-source spirit within a highly competitive space. Help other people by letting them know if this AI was useful.",https://www.langtrace.ai/?ref=taaft&utm_source=taaft&utm_medium=referral,https://media.theresanaiforthat.com/assets/favicon-large.png,Ola Muse,4.5,2,LLM management,"monitoring tool, language models, ai application enhancement, ai metric analysis, security soc2typeii, ai sdk",Free + from $39/mo
