Title,Use Cases,Description,Website,Logo,Author,Average Rating,Rating Count,Primary Task,Tags,Price
YT Ideas,Generate your next YT video idea in seconds.,"The Youtube Video Ideas Generator is an AI tool designed to assist content creators with generating ideas for their Youtube videos. This tool is perfect for users who are in need of inspiration for their video content creation. When using this tool, ideas for potential video topics are produced within seconds, simplifying the YouTube video planning process for creators. Developers need to provide their channel ID in order to generate video concepts directly related to their content creation sphere. Besides offering immediate and integral support to your brainstorming process, what makes this tool even more distinctive is its ability to have already generated almost 3000 ideas for video content so far showcasing its practical utility. The Youtube Video Ideas Generator is developed by Harsh Singh and Debjyoti Banerjee, two developers committed to providing functional and user-friendly solutions to content creators. Help other people by letting them know if this AI was useful.",https://yt-ideas.vercel.app/?ref=taaft&utm_source=taaft&utm_medium=referral,https://media.theresanaiforthat.com/assets/favicon-large.png,Unknown Author,1.0,1,Youtube content ideas,"content creation, idea generation, youtube, brainstorming tool, video topics, personalized suggestions",No price available
AI ColoringPage Online,"Generate unique, printable coloring pages using AI.","AI ColoringPage Online is an artificial intelligence (AI) tool designed to generate unique and printable coloring pages. Users input prompt words and the system uses this information to create unique, high quality coloring pages. This user-friendly tool is accessible to individuals with varying levels of design experience and promotes exploration and experimentation with different creative ideas. The tool has applications in both leisure activities and professional design projects. Various plans are available, including free and paid options, accommodating different project sizes and user needs. The paid plans provide a higher credit limit and faster generation of coloring pages. AI ColoringPage Online is powered by the DALLE-3 AI model. Users are advised to respect copyright and create designs without borrowing styles from living artists. The tools webpage has a dashboard which the user can use to control and supervise the generation process. All financial transactions within the service are secure, processed by Stripe. Help other people by letting them know if this AI was useful.",https://www.aicoloringpages.online/?ref=taaft&utm_source=taaft&utm_medium=referral,https://media.theresanaiforthat.com/assets/favicon-large.png,Unknown Author,5.0,1,Coloring pages,"coloring pages, creativity, graphic design, printable, user-friendly, recreation",Free + from $5/mo
HumanizeAI,Transform your AI-generated content into human-like text.,"Humanize AI transforms AI-generated text into human-like content. This AI-to-human text converter, also known as the AI Humanizer, is designed to refine and rephrase text created by different AI writers, eliminating robotic undertones. The output is undetectable by AI detection systems and retains the original meaning, context, and SEO value of the text. Humanize AI uses proprietary algorithms to convert text from AI sources such as ChatGPT, Google Bard, Microsoft Bing, QuillBot, Grammarly, Jasper.ai, Copy.ai, into natural, human-like wording. Its process encompasses various elements such as natural language usage, empathy, personalization, engagement, simplicity, and cultural sensitivity. The tool has a user-friendly interface and it requires no registration or sign-up. It supports various languages and is compatible with all browsers. Users can freely convert AI text to human-like text using this online platform, which also ensures strict confidentiality of content and provides rapid and efficient results. The humanized AI text created is devoid of grammatical errors and odd word choices, and is SEO-friendly, maintaining its original context and meaning. This aids in increasing engagement and boosting conversions through emotionally charged and relatable content. Help other people by letting them know if this AI was useful.",https://www.humanizeai.pro/?ref=taaft&utm_source=taaft&utm_medium=referral,https://media.theresanaiforthat.com/assets/favicon-large.png,Artur Zhdan,4.8,5,Text humanization,"ai to human conversion, text rephraser, content humanizer, ai writers, seo friendly, ai text optimizer",No price available
AI Client Finder by SynthMind,Find Your Potential Clients’ Accurate Contact Data with AI,"AI Client Finder by SynthMind AI is an AI-powered tool that helps businesses identify suitable leads. It searches the entire web and professional databases to discover contacts and companies that fit the provided buyer profiles. The tool also provides the latest information on potential clients which can be used as a starting point in conversations. It ensures the contact information of leads are always verified in real time, thereby connecting businesses with relevant, qualified leads. The AI Client Finder stands apart due to its ability to understand the needs and challenges of your prospects, providing not just contacts but meaningful points of interaction. It is designed to be simple, cost-effective, quicker, and more precise, making it especially beneficial for small and medium-sized businesses without a sales team. To use AI Client Finder, businesses need to build potential client profiles. The tool will then search for the latest corresponding information from the web and databases, and compile detailed potential client profiles. With this tool, businesses can elevate their sales process by leveraging AI-powered technology for lead generation. Help other people by letting them know if this AI was useful.",https://synthmind.app/ad/leadsai3/?utm_campaign=nav_taaft,https://media.theresanaiforthat.com/assets/favicon-large.png,Jilong Zhou,3.3,3,Customer leads,"lead generation, contact verification, customer profiling, sales support, real-time data, ai-powered",Free + from $49.8/mo
SheetyAI,Generate formulas for your spreadsheets with AI.,"Sheety.ai is an AI-powered tool designed to generate and solve spreadsheet formulas. Users define their problem, and Sheety.ai uses artificial intelligence to generate the appropriate formula. This makes it an efficient tool to create complex formulas without having to remember exact syntax or worry about potential errors. In addition to formula generation, Sheety.ai allows users to save and store their formulas in their account, offering the convenience of accessing them from anywhere. This feature is particularly useful for frequent spreadsheet users who need to reuse or refine their past formulas. Learnings can also be applied from previously generated formulas from other users, as Sheety.ai provides an assortment of latest formulas as examples on its site. However, please note, usage is limited for anonymous users, prompting for an account creation for unlimited access. Developed and hosted in Switzerland, Sheety.ai emphasizes its attention towards privacy of its users. Help other people by letting them know if this AI was useful.",https://sheety.ai/formula-generator?ref=taaft&utm_source=taaft&utm_medium=referral,https://media.theresanaiforthat.com/assets/favicon-large.png,Unknown Author,5.0,1,Excel formulas,"spreadsheet formulas, syntax generation, error prevention, formula storage, remote access, formula reuse",No price available
Informly Idea Validator,Validate and grow your business idea with AI.,"The Informly Idea Validator is an AI-powered tool designed to assist entrepreneurs in validating their business ideas instantly. Users provide a detailed description of their business idea, and the AI system generates a comprehensive analysis report validating the idea. The tool analyses various aspects of a business idea, including business viability, target audience, ideal team, business model, and more. It is intended to save weeks of manual work as it swiftly generates validation reports. The tool also offers a suite of 10 meticulously crafted actionable plans designed to guide users in transforming their ideas into reality. These plans aim to provide clear, step-by-step guidance across vital aspects like pitch deck preparation, MVP roadmap creation, landing page blueprint generation, launch strategy formulation, and more. Additionally, the tool has AI business advisors that provide personalized, data-driven advice to improve business strategies. The tool is designed to validate business ideas within minutes instead of weeks, thus saving time, aiding in faster go-to-market strategies, and boosting confidence in business ideas. It aims to offer a cost-effective alternative to traditional research methods, thus saving money. Users can easily navigate the platform without any technical jargon or complex processes. Help other people by letting them know if this AI was useful.",https://validator.informly.ai/?ref=taaft&utm_source=taaft&utm_medium=referral,https://media.theresanaiforthat.com/assets/favicon-large.png,Edisa Silva,5.0,21,Startup ideas,"business idea validation, entrepreneurship, ai advisor, business strategy, startups, business plan creation",Free + from $62/mo
Write Minimal,"A minimal, beautiful, and AI powered writing experience.","Write Minimal is an AI-powered writing platform with a minimalist design focused on improving the writing experience by removing distractions. This tool provides a clean and welcoming environment, akin to writing on a high-quality blank sheet of paper. The typography is delicately designed to optimize readability across different screen sizes. It also includes an effortless inline editor for personalizing the formatting of the text. One of the significant features of Write Minimal is the AI capabilities embedded in the platform. The AI is geared to help users organize, summarize, and structure their writing. This assistance not only saves valuable time but also enhances the quality of the output, making it particularly advantageous for content writers and editors. Additionally, Write Minimal facilitate users in repurposing their writing into various formats such as blog posts, tweets, or LinkedIn posts, streamlining the process of adjusting content for different platforms. Therefore, Write Minimal serves as an efficient, user-friendly digital tool for individuals seeking a high-value writing experience. Help other people by letting them know if this AI was useful.",https://www.writeminimal.com/?ref=taaft&utm_source=taaft&utm_medium=referral,https://media.theresanaiforthat.com/assets/favicon-large.png,nitesh sharma,4.5,4,Writing,"ai writing tool, minimalist design, content generation, distraction-free writing, inline editor, ai text organization",No price available
AskDocs,Turn reading and research into saved time.,"AskDocs is an AI assistant developed to efficiently manage reading and research tasks. The tool can handle a variety of document formats including legal contracts, academic papers, and even cater to different media content such as YouTube links. The AI assistant is capable of quickly scanning, understanding, and finding relevant details from these documents. Furthemore, AskDocs is adept at summarizing dense information, thereby providing the user with compact, insightful answers paired with citations. Its multi-document processing capability allows users to conduct extensive research across complex documents simultaneously, further accelerating data processing and retrieval. AskDocs also features document questioning options which range from single to group document questioning, making it a flexible and user-friendly tool. It supports multiple file types including PDF, DOCX, TXT, CSV, EPUB and expands its utility by providing YouTube Link processing as well. Additionally, this tool utilises advanced NLP models like GPT-3.5 and GPT-4 to extract questions and provide precise answers from the documents. AskDocs aims at enhancing productivity along with maintaining a high level of accuracy and fast processing time, effectively making it a powerful research assistant. Help other people by letting them know if this AI was useful.",https://www.askdocs.com/?ref=taaft&utm_source=taaft&utm_medium=referral,https://media.theresanaiforthat.com/assets/favicon-large.png,Nick Jacques,0.0,0,Document Q&A,"ai research assistant, document processing, reading management, text summarization, legal document analysis, academic research",Free + from $9/mo
Breadcrumb,Insights dashboard for analyzing business data.,Help other people by letting them know if this AI was useful.,https://www.breadcrumb.ai/?ref=taaft&utm_source=taaft&utm_medium=referral,https://media.theresanaiforthat.com/assets/favicon-large.png,Marcus Ellison,1.0,1,Dashboards,"dashboard, data, analysis, business, insights, data visualizations",No price available
Heatseeker,Test your products and messaging with AI-powered campaigns before launch.,"Heatseeker is an AI-powered tool designed for predicting the success and market readiness of a business, product or campaign prior to its launch. It enables businesses to test their products and messaging with digital campaigns. The tool uses AI for competitive analysis, researching competitors and providing an audit report. This helps businesses understand how customers are currently perceiving the problem they aim to solve. Heatseeker is also valuable for validating business models. With in-market campaigns, users can test various models like freemium, subscription, and affiliate, to understand what resonates best with their target audience. Additionally, Heatseeker allows businesses to test multiple variations of their product's messaging and value proposition before solidifying a long-term marketing strategy, ensuring the messaging is aligned with their customers' language from the outset. To aid in market testing, digital test campaigns can gauge market interest in a product even before development. These capabilities result in actionable market intelligence guiding effective product launch strategies. Help other people by letting them know if this AI was useful.",https://www.heatseeker.ai/?ref=taaft&utm_source=taaft&utm_medium=referral,https://media.theresanaiforthat.com/assets/favicon-large.png,Rutger Coolen,5.0,1,Market research,"ai-powered marketing, product testing, brand messaging, digital campaigns, market readiness prediction, competitive analysis",Free + from $99/mo
InLinks,"Entity SEO tool for content, schema, Internal linking & Social Media.","Inlinks Entity SEO Tool - InLinks is a comprehensive solution targeting search engine optimization, content enhancement, and social media management. This tools key features include the ability to automatically deploy crucial SEO elements at scale, optimize content for both search engines and users, and rapidly update pages. It also simplifies internal linking by automatically creating and optimizing internal links, thereby enhancing the contextual relevance of your site's content. Further, it augments your content strategy with entity-based page and site graph optimization, using its built-in knowledge graph to interpret content and communicate entities in a way that search engines understand. Besides, it provides content optimization guidance based on competitors' content, suggesting structured content briefs encompassing in-depth topic maps, entities and their associated concepts, and more. The tool even incorporates an AI Content Writing Assistant for drafting content. Additionally, its keyword research facet offers in-depth exploration of keywords and queries, presenting contextually relevant keyword research based on dynamic data. Lastly, it enables the creation, scheduling, and posting of content across multiple social media platforms, thus providing an all-round solution for your digital marketing needs. Help other people by letting them know if this AI was useful.",https://inlinks.com/?fpr=taaft,https://media.theresanaiforthat.com/assets/favicon-large.png,Dixon Jones,5.0,8,SEO content,"seo, content writer, social media management, internal linking, entity-based optimization, knowledge graph",from $49
Beeyond AI,Beeyond AI: Unlock 50+ AI tools under one subscription,Help other people by letting them know if this AI was useful.,https://www.beeyondai.com/?ref=taaft&utm_source=taaft&utm_medium=referral,https://media.theresanaiforthat.com/assets/favicon-large.png,ANAND SHRESTHA,5.0,4,Productivity,"writing, image, content generation, pdf, productivity, art",Free + from $16
BulkContent,Maximize Your SEO Impact with Up to 500 AI-Crafted Content Articles.,Help other people by letting them know if this AI was useful.,https://bulkcontent.ai/?ref=taaft&utm_source=taaft&utm_medium=referral,https://media.theresanaiforthat.com/assets/favicon-large.png,Brad Morgan,5.0,1,SEO content,"seo content, wordpress content, content generation, website content, blog content generation, blog content creation",from $0.50
Grapha AI,Uncover hidden trends and patterns in your data effortlessly.,"Grapha.ai operates as an AI-driven data exploration and analysis tool that aims to assist in interpreting complex datasets. The software is built on data science practices, as it deploys AI technology to reveal hidden trends and patterns in data, transforming them into clear insights. Advancing with this, the user does not need to wrestle with coding or complex formulas to operate the system; instead, they merely need to query the AI with their area of interest. An additional feature of Grapha.ai is its capacity to develop stunning visualizations, allowing users to analyze data in a more visually-enticing and comprehendible manner. The tool also allows users to manage and share their data, ensuring user control over data privacy and ownership. Further, Grapha.ai enables the easy export of clean data behind the visualizations, enhancing the accessibility and usefulness of the analyzed data. Upgrade options, including Grapha Prime, offer enhanced features such as more questions per month, extended data and report retention, CSV upload and Google Sheets integration. There are no recurring charges as users can manually renew their membership at the end of its period. Help other people by letting them know if this AI was useful.",https://grapha.ai/?ref=taaft&utm_source=taaft&utm_medium=referral,https://media.theresanaiforthat.com/assets/favicon-large.png,Prince Harshan,4.0,6,Data analysis,"data analysis, advanced visualizations, data science, ai technology, pattern recognition, trend analysis",from $150
VideoPoet by Google,Transforming language models into video generators.,"VideoPoet, by Google Research, represents a significant evolution in video generation, particularly in producing large, interesting, and high-fidelity motions. This tool is used to convert autoregressive language models into a high-quality video generator. It includes components such as MAGVIT V2 video tokenizer and SoundStream audio tokenizer that transform images, video, and audio clips with variable lengths into a sequence of discrete codes in a unified vocabulary. These codes are allied with text-based language models, allowing integration with other modalities such as text. An autoregressive language model, contends within this tool, learns across video, image, audio, and text modalities to autoregressively predict the next video or audio token in the sequence. It further combines multimodal generative learning objectives into the training framework, such as text-to-video, text-to-image, image-to-video, video frame continuation, video inpainting and outpainting, video stylization, and video-to-audio. VideoPoet can generate videos in square orientation or portrait to cater for short-form content. It also supports generating audio from a video input. With capability of multitasking on a variety of video-centric inputs and outputs, VideoPoet illustrates how language models can synthesize and edit videos with desirable temporal consistency. Help other people by letting them know if this AI was useful.",https://sites.research.google/videopoet/?ref=taaft&utm_source=taaft&utm_medium=referral,https://media.theresanaiforthat.com/assets/favicon-large.png,Unknown Author,5.0,1,Videos,"video generation, language models, google research, magvit v2 video tokenizer, soundstream audio tokenizer, video synthesis",No price available
HitWit,"Collect ideas from many high-quality sources, dig deep into your topics",Help other people by letting them know if this AI was useful.,https://www.hitwit.ai/?ref=taaft&utm_source=taaft&utm_medium=referral,https://media.theresanaiforthat.com/assets/favicon-large.png,Badri Varadarajan,4.9,19,Learning,"ai learning, metacognition, multimodal ai, self-learning tool, deep learning, high-intensity learning",No price available
MindMac,"Feature-rich & elegant ChatGPT macOS client, supports multiple AI providers",Help other people by letting them know if this AI was useful.,https://mindmac.app/?ref=taaft&utm_source=taaft&utm_medium=referral,https://media.theresanaiforthat.com/assets/favicon-large.png,Hoang Nguyen,5.0,13,ChatGPT on Mac,"chatgpt client, macos, openai, azure openai, google gemini, productivity tools",from $29
Giftit,Find out what your friends want without killing the surprise.,"Giftit is an AI tool designed to help users choose suitable gifts by engaging their contacts in anonymous, automated conversations. The tool uses a persona named 'Sherlock' who can communicate with your friends through popular messaging platforms like WhatsApp and iMessage. Based on these interactions, it helps identify potential gift items. The application is built for various occasions, such as birthdays, graduations or spontaneous gifting moments. Users start by selecting a contact, after which Sherlock interacts with the chosen friend. This interaction is completely anonymous, allowing users to stay behind the scenes. Subsequently, users can view the results from the discussion between Sherlock and their friend, aiding them to select the perfect gift. The outcome can be viewed either as a full conversation transcript or as a summary generated by the software. The tool has been positively reviewed by users for its human-like interaction and its ability to help think of unique gift ideas. According to the available information, Giftit has a user-friendly interface and is created and managed in Europe. Help other people by letting them know if this AI was useful.",https://www.giftit.social/?ref=taaft&utm_source=taaft&utm_medium=referral,https://media.theresanaiforthat.com/assets/favicon-large.png,Unknown Author,4.0,9,Gift ideas,"gift selection, automated conversations, anonymous interaction, surprise gifts, birthdays, graduations",Free
WavoAI,Transforming your audio into actionable insights.,"WavoAI is an AI-powered tool that transforms audio into interactive transcripts and actionable insights. This tool is designed to take the transcription process to the next level by offering automatic transcriptions that identify speaker (diarization), allow annotations and provide a comprehensive analysis using AI. These transcripts are fashioned to cater to multiple languages, accents, and dialects. WavoAI also provides a distinctive AI assistant that delivers insights, possible action points, To Do's, and summaries tailored to your specific transcript. This makes it suitable for transforming lengthy audio or recordings, such as those from focus groups, into analyzable text. In addition to these, WavoAI promises seamless integration with existing tools and workflows, further enhancing productivity. Users of WavoAI can anticipate a new way of navigating through extensive audios or recordings, making it a valuable solution for communication needs in various fields. Help other people by letting them know if this AI was useful.",https://wavoai.com/?ref=taaft&utm_source=taaft&utm_medium=referral,https://media.theresanaiforthat.com/assets/favicon-large.png,Al Seo,5.0,71,Audio transcription,"audio transcription, speech recognition, automated transcription, multi-language support, dialect recognition, speaker identification",Free + from $8.99/mo
